,order date,CF number,Number,Order no.,recipient,Tel,Address
,2022/12/7,CF202212280000188001,HD2022120794393492,AA4845027,Yvonne Chui 周小姐,###,九龍紅磡灣中心G座4搜3
,2022/12/7,CF202212280000188002,HD2022120794393493,202709231904461244,,95808216,"Rm330, man hing hse, Tai hang Sal est,  shek kip me"
,2022/12/7,CF202212280000188003,HD2022120794393494,ZUZZTUTU132/48ZUU,S Wing Lam 林小姐,61005144,沙田 大圖 美田邨 美樂樓 3409室
,2022/12/7,CF202212280000188004,HD2022120794393495,2022101012594y0V,Lin Yeur 林均,7557630,Hona Kong 新界屯門區屯門友愛村愛義樓1004
,2022/12/7,CF202212280000188005,HD2022120794393496,2022TUTU132/48Z00,田小姐,2409510,杳港大坑浣紗街33-45號 浣紗花園2701室